{
    "$schema": "https://github.com/cloud-emoticon/store-repos/raw/master/schema/RepositoryMetadata.json",
    "name": "KT's favorites",
    "location": {
        "type": "localJson"
    },
    "description": "KT's favorites. What comes default by Cloud Emoticon 1 for Android.",
    "author": {
        "name": "KTachibanaM",
        "url": "https://twitter.com/KTachibana_M",
        "avatarUrl": "https://raw.githubusercontent.com/cloud-emoticon/store-repos/master/avatars/KTachibana_M.jpg"
    }
}