{
    "$schema": "https://github.com/cloud-emoticon/store-repos/raw/master/schema/RepositoryMetadata.json",
    "name": "Midori",
    "location": {
        "type": "localXml"
    },
    "description": "Midori",
    "author": {
        "name": "Midori Yakumo",
        "url": "https://twitter.com/MidoriYakumo",
        "avatarUrl": "https://raw.githubusercontent.com/cloud-emoticon/store-repos/master/avatars/Midori Yakumo.png"
    }
}