{
    "$schema": "https://github.com/cloud-emoticon/store-repos/raw/master/schema/RepositoryMetadata.json",
    "name": "Oliver Wang",
    "location": {
        "type": "localXml"
    },
    "description": "Oliver Wang",
    "author": {
        "name": "Oliver Wang",
        "url": "https://twitter.com/Toohashi",
        "avatarUrl": "https://raw.githubusercontent.com/cloud-emoticon/store-repos/master/avatars/Oliver Wang.jpg"
    }
}