{
    "$schema": "https://github.com/cloud-emoticon/store-repos/raw/master/schema/RepositoryMetadata.json",
    "name": "Yashi-poi",
    "location": {
        "type": "localXml"
    },
    "description": "Yashi-poi. What comes default by Cloud Emoticon 1 for iOS.",
    "author": {
        "name": "神楽坂雅詩",
        "url": "https://twitter.com/kagurazakayashi",
        "avatarUrl": "https://raw.githubusercontent.com/cloud-emoticon/store-repos/master/avatars/神楽坂雅詩.png"
    }
}