{
    "$schema": "https://github.com/cloud-emoticon/store-repos/raw/master/schema/RepositoryMetadata.json",
    "name": "A岛颜文字汇集",
    "location": {
        "type": "localXml"
    },
    "description": "A岛颜文字汇集",
    "author": {
        "name": "陈少举",
        "url": "https://twitter.com/chenshaoju",
        "avatarUrl": "https://raw.githubusercontent.com/cloud-emoticon/store-repos/master/avatars/陈少举.jpg"
    }
}