{
    "$schema": "https://github.com/cloud-emoticon/store-repos/raw/master/schema/RepositoryMetadata.json",
    "name": "Remote repo demo",
    "location": {
        "type": "remoteJson",
        "remoteUrl": "http://www.ktachibana.party/cloudemoticon/remote-demo.json"
    },
    "description": "A demo to show how to host a repo not on https://github.com/cloud-emoticon/store-repos\nIt will still have the same content as 'KT's favorites'",
    "author": {
        "name": "KTachibanaM",
        "url": "https://twitter.com/KTachibana_M",
        "avatarUrl": "https://raw.githubusercontent.com/cloud-emoticon/store-repos/master/avatars/KTachibana_M.jpg"
    }
}