{
    "$schema": "https://github.com/cloud-emoticon/store-repos/raw/master/schema/RepositoryMetadata.json",
    "name": "CIA",
    "location": {
        "type": "localJson"
    },
    "description": "What the CIA uses",
    "author": {
        "name": "KTachibanaM",
        "url": "https://twitter.com/KTachibana_M",
        "avatarUrl": "https://raw.githubusercontent.com/cloud-emoticon/store-repos/master/avatars/KTachibana_M.jpg"
    }
}