{
    "$schema": "https://github.com/cloud-emoticon/store-repos/raw/master/schema/RepositoryMetadata.json",
    "name": "颜文字屋",
    "location": {
        "type": "localXml"
    },
    "description": "kaomojiya.com transformed by wicast",
    "author": {
        "name": "wicast chen",
        "url": "https://twitter.com/wicastchen",
        "avatarUrl": "https://raw.githubusercontent.com/cloud-emoticon/store-repos/master/avatars/wicast chen.jpg"
    }
}